<!DOCTYPE module SYSTEM "module.dtd">

<module name="green_attractor">
  <doc>
    <description>
This module is written by mavCourse 2022 group 2. It was inspired by the orange_avoider.
This module is used in combination with a color filter (cv_detect_color_object) and the navigation mode of the autopilot.
The avoidance strategy is to simply count the total number of green pixels (track floor). When below a certain percentage threshold,
(given by color_count_frac) we assume that there is an obstacle and we turn.

The color filter settings are set using the cv_detect_color_object. This module can run multiple filters simultaneously
so you have to define which filter to use with the ORANGE_AVOIDER_VISUAL_DETECTION_ID setting.
    </description>
    <!-- maybe skip changing the msg stuff to green_attractor -->
    <define name="ORANGE_AVOIDER_VISUAL_DETECTION_ID" value="ABI_BROADCAST" description="which VISUAL_DETECTION message to recieve for orange pole detection."/>
  </doc>
    <settings>
    <dl_settings>
      <dl_settings name="GreenAttractor">
         <dl_setting var="oa_color_count_frac" min="0" step="0.01" max="1.0"/>
         <dl_setting var="meander_frac" min="0" step="0.01" max="1.0"/>
         <dl_setting var="meander_increment" min="0" step="1" max="20"/>
      </dl_settings>
    </dl_settings>
  </settings>
  
  <dep>
    <depends>cv_detect_color_object</depends>
  </dep>
  <header>
    <file name="green_attractor.h"/>
  </header>
  <init fun="green_attractor_init()"/>
  <periodic fun="green_attractor_periodic()" freq="4"/> <!-- tweak -->
  <periodic fun="log_distance_covered_periodic()" freq="1"/>
  <makefile target="ap|nps">
    <file name="green_attractor.c"/>
  </makefile>
</module>
