<!DOCTYPE module SYSTEM "module.dtd">

<module name="imu_aspirin_v2_common" dir="imu" task="sensors">
  <doc>
    <description>
      Common functionality of Aspirin v2 IMUs. The Aspirin IMU can be used on different flight controllers. 
      Most commonly used onboard a Lisa M(X) v2.1 FC, but IMU can be connected over SPI to other flight controllers as well. 
      The Aspirin IMU consists of:
      - Accelerometer and Gyro: MPU6000 connected over SPI.
      - Magnetometer: HMC5883 as I2C slave of the MPU6000 Acc/gyro.
      - Barometer: ms5611 connected over SPI as well, but this is not handled by this module, but by the barometer module.
    </description>
    <configure name="ASPIRIN_2_SPI_DEV" value="spi2" description="SPI device to use for for the IMU sensor"/>
    <configure name="ASPIRIN_2_SPI_SLAVE_IDX" value="SPI_SLAVE2" description="On which slave index the IMU is connected"/>
    <define name="ASPIRIN_2_DISABLE_MAG" value="FALSE" description="set to TRUE to disable the mag on Aspirin"/>
    <define name="ASPIRIN_2_ROTATED_180_DEG" value="FALSE" description="set to TRUE if IMU is 180 degrees rotated on Z axis on Aspirin IMU, default is False"/>
    
    <section name="IMU" prefix="IMU_">
      <define name="MAG_X_NEUTRAL" value="2350"/>
      <define name="MAG_Y_NEUTRAL" value="2350"/>
      <define name="MAG_Z_NEUTRAL" value="2100"/>

      <define name="MAG_X_SENS" value="3.50" integer="16"/>
      <define name="MAG_Y_SENS" value="3.60" integer="16"/>
      <define name="MAG_Z_SENS" value="4.90" integer="16"/>
    </section>
  </doc>
  <dep>
    <depends>spi_master,imu_common</depends>
    <provides>imu,mag</provides>
  </dep>
  <header>
    <file name="imu_aspirin_2_spi.h"/>
  </header>
  <init fun="imu_aspirin2_init()"/>
  <periodic fun="imu_aspirin2_periodic()"/>
  <event fun="imu_aspirin2_event()"/>
  <makefile target="!sim|nps|fbw">
    <configure name="ASPIRIN_2_SPI_DEV" default="spi2" case="lower|upper"/>
    <configure name="ASPIRIN_2_SPI_SLAVE_IDX" default="SPI_SLAVE2"/>

    <define name="ASPIRIN_2_SPI_DEV" value="$(ASPIRIN_2_SPI_DEV_LOWER)"/>
    <define name="USE_$(ASPIRIN_2_SPI_DEV_UPPER)"/>
    <define name="ASPIRIN_2_SPI_SLAVE_IDX" value="$(ASPIRIN_2_SPI_SLAVE_IDX)"/>
    <define name="USE_$(ASPIRIN_2_SPI_SLAVE_IDX)"/>

    <file name="mpu60x0.c" dir="peripherals"/>
    <file name="mpu60x0_spi.c" dir="peripherals"/>
    <file name="imu_aspirin_2_spi.c"/>
  </makefile>
</module>
