<!DOCTYPE module SYSTEM "module.dtd">

<module name="datalink_common" dir="datalink" task="datalink">
  <doc>
    <description>
      Common datalink interface for telemetry, downlink and uplink
    </description>
  </doc>
  <header>
    <file name="telemetry.h"/>
    <file name="datalink.h"/>
    <file name="downlink.h"/>
  </header>
  <init fun="datalink_init()"/>
  <init fun="downlink_init()"/>
  <periodic fun="telemetry_reporting_task()"/>
  <periodic fun="datalink_periodic()" freq="1"/>
  <datalink message="ALIVE_REQ" fun="datalink_parse_ALIVE_REQ(dev, trans, buf)"/>
  <datalink message="PING" fun="datalink_parse_PING(dev, trans, buf)"/>
  <makefile>
    <define name="DOWNLINK"/>
    <define name="PERIODIC_TELEMETRY"/>
    <configure name="TELEMETRY_FREQUENCY" default="$(PERIODIC_FREQUENCY)"/>
    <define name="TELEMETRY_FREQUENCY" value="$(TELEMETRY_FREQUENCY)"/>
    <file name="downlink.c"/>
    <file name="datalink.c"/>
    <file name="telemetry.c"/>
    <test firmware="fixedwing">
      <define name="DOWNLINK_TRANSPORT" value="pprz_tp"/>
      <define name="DOWNLINK_DEVICE" value="uart1"/>
      <define name="USE_UART1"/>
    </test>
  </makefile>
  <makefile target="!fbw" firmware="fixedwing">
    <file name="ap_downlink.c" dir="$(SRC_FIRMWARE)"/>
    <test firmware="fixedwing">
      <define name="DOWNLINK_TRANSPORT" value="pprz_tp"/>
      <define name="DOWNLINK_DEVICE" value="uart1"/>
      <define name="USE_UART1"/>
    </test>
  </makefile>
  <makefile firmware="fixedwing">
    <file name="fbw_downlink.c" dir="$(SRC_FIRMWARE)"/>
  </makefile>
  <makefile firmware="rotorcraft">
    <file name="rotorcraft_telemetry.c" dir="$(SRC_FIRMWARE)"/>
    <test firmware="rotorcraft">
      <define name="DOWNLINK_TRANSPORT" value="pprz_tp"/>
      <define name="DOWNLINK_DEVICE" value="uart1"/>
      <define name="USE_UART1"/>
    </test>
  </makefile>
  <makefile firmware="rover">
    <file name="rover_telemetry.c" dir="$(SRC_FIRMWARE)"/>
    <test firmware="rover">
      <define name="DOWNLINK_TRANSPORT" value="pprz_tp"/>
      <define name="DOWNLINK_DEVICE" value="uart1"/>
      <define name="USE_UART1"/>
      <define name="USE_GENERATED_AUTOPILOT"/>
    </test>
  </makefile>
</module>

